{
  "$schema": "https://json-schema.org/draft/2020-12/schema",
  "$id": "https://puretokensx.com/schemas/model-profile.schema.json",
  "title": "Pure Tokens installed media model profile",
  "type": "object",
  "required": ["schemaVersion", "capability", "catalogUpdatedAt", "catalogCapturedAt", "id", "parameterSchema"],
  "properties": {
    "$schema": { "const": "https://puretokensx.com/schemas/model-profile.schema.json" },
    "schemaVersion": { "const": 1 },
    "capability": { "enum": ["image", "video"] },
    "catalogUpdatedAt": { "type": "string", "minLength": 1 },
    "catalogCapturedAt": { "type": "string", "format": "date-time" },
    "id": { "type": "string", "maxLength": 160, "pattern": "^(?!\\.{1,2}$)[A-Za-z0-9_.-]+(?: [A-Za-z0-9_.-]+)*(\\([A-Za-z0-9_.-]+\\))?$(?![\\s\\S])" },
    "parameterSchema": { "type": "object" },
    "sourceReview": { "type": "object", "required": ["reviewedAt", "scope", "source"], "properties": { "reviewedAt": { "type": "string" }, "scope": { "const": "reviewed_source_not_live_availability" }, "source": { "type": "string" } }, "additionalProperties": false }
  },
  "additionalProperties": false
}
