{
  "$schema": "https://puretokensx.com/schemas/model-profile.schema.json",
  "schemaVersion": 1,
  "capability": "video",
  "catalogUpdatedAt": "2026-10-24",
  "catalogCapturedAt": "2026-10-24T11:09:36.781Z",
  "id": "kling-v3-turbo",
  "parameterSchema": {
    "properties": {
      "prompt": {
        "type": "string",
        "required": true
      },
      "duration": {
        "type": "integer",
        "enum": [
          3,
          4,
          5,
          6,
          7,
          8,
          9,
          10,
          11,
          12,
          13,
          14,
          15
        ],
        "default": 5
      },
      "resolution": {
        "type": "string",
        "enum": [
          "720p",
          "1080p"
        ],
        "default": "720p"
      },
      "aspect_ratio": {
        "type": "string",
        "enum": [
          "16:9",
          "9:16",
          "1:1"
        ],
        "default": "16:9"
      }
    },
    "lifecycle": {
      "create": {
        "successStatus": 200,
        "idField": "id",
        "object": "video",
        "initialStatuses": [
          "queued",
          "in_progress"
        ]
      },
      "poll": {
        "method": "GET",
        "path": "/v1/videos/{task_id}",
        "intervalSeconds": 8,
        "statusField": "status",
        "pendingStatuses": [
          "queued",
          "in_progress"
        ],
        "successStatuses": [
          "completed"
        ],
        "failureStatuses": [
          "failed"
        ],
        "resultFields": [
          "metadata.url"
        ]
      }
    },
    "operations": {
      "video_generation": {
        "request": {
          "method": "POST",
          "path": "/v1/videos",
          "contentType": "application/json"
        },
        "requiredBodyFields": [
          "model",
          "prompt"
        ],
        "inputs": {}
      }
    },
    "constraints": {
      "reference_counts": {
        "first_frame_image": 1,
        "last_frame_image": 1,
        "reference_images": 0,
        "reference_videos": 0,
        "reference_audios": 0,
        "video": 1,
        "max_total": 1
      },
      "reference_transport": {}
    }
  },
  "sourceReview": {
    "reviewedAt": "2026-10-21",
    "scope": "reviewed_source_not_live_availability",
    "source": "PureTokenPlus_web/config/model-metadata-official.json"
  }
}
