{
  "$schema": "https://puretokensx.com/schemas/model-profile.schema.json",
  "schemaVersion": 1,
  "capability": "video",
  "catalogUpdatedAt": "2026-10-21",
  "catalogCapturedAt": "2026-10-21T02:29:21.846Z",
  "id": "viduq4-preview",
  "parameterSchema": {
    "properties": {
      "prompt": {
        "type": "string",
        "required": false,
        "maxLength": 1500
      },
      "duration": {
        "type": "integer",
        "enum": [
          3,
          4,
          5,
          6,
          7,
          8,
          9,
          10,
          11,
          12,
          13,
          14,
          15,
          16
        ],
        "default": 5
      },
      "resolution": {
        "type": "string",
        "enum": [
          "540p",
          "720p",
          "1080p",
          "2k",
          "4k"
        ],
        "default": "720p"
      },
      "aspect_ratio": {
        "type": "string",
        "enum": [
          "16:9",
          "9:16",
          "1:1",
          "3:4",
          "4:3"
        ],
        "default": "16:9"
      },
      "first_frame_image": {
        "type": "string"
      },
      "reference_images": {
        "type": "string[]"
      },
      "reference_audios": {
        "type": "string[]"
      },
      "generate_audio": {
        "type": "boolean"
      },
      "seed": {
        "type": "integer",
        "min": 0
      },
      "is_rec": {
        "type": "boolean"
      }
    },
    "operations": {
      "image_to_video": {
        "request": {
          "method": "POST",
          "path": "/v1/videos",
          "contentType": "application/json"
        },
        "requiredBodyFields": [
          "model",
          "first_frame_image"
        ],
        "inputs": {
          "first_frame_image": {
            "field": "first_frame_image",
            "required": true,
            "minItems": 1,
            "maxItems": 1,
            "transports": [
              "https_url"
            ]
          }
        }
      },
      "reference_image_video": {
        "request": {
          "method": "POST",
          "path": "/v1/videos",
          "contentType": "application/json"
        },
        "requiredBodyFields": [
          "model",
          "prompt",
          "reference_images"
        ],
        "inputs": {
          "reference_images": {
            "field": "reference_images",
            "required": true,
            "minItems": 1,
            "maxItems": 15,
            "transports": [
              "https_url"
            ]
          }
        }
      },
      "reference_audio": {
        "request": {
          "method": "POST",
          "path": "/v1/videos",
          "contentType": "application/json"
        },
        "requiredBodyFields": [
          "model",
          "prompt",
          "reference_images",
          "reference_audios"
        ],
        "inputs": {
          "reference_images": {
            "field": "reference_images",
            "required": true,
            "minItems": 1,
            "maxItems": 15,
            "transports": [
              "https_url"
            ]
          },
          "reference_audios": {
            "field": "reference_audios",
            "required": true,
            "minItems": 1,
            "maxItems": 3,
            "transports": [
              "https_url"
            ]
          }
        }
      }
    },
    "lifecycle": {
      "create": {
        "successStatus": 200,
        "idField": "id",
        "object": "video",
        "initialStatuses": [
          "queued",
          "in_progress"
        ]
      },
      "poll": {
        "method": "GET",
        "path": "/v1/videos/{task_id}",
        "intervalSeconds": 8,
        "statusField": "status",
        "pendingStatuses": [
          "queued",
          "in_progress"
        ],
        "successStatuses": [
          "completed"
        ],
        "failureStatuses": [
          "failed"
        ],
        "resultFields": [
          "metadata.url"
        ]
      }
    },
    "constraints": {
      "reference_combination": {
        "audio_requires_visual": [
          true
        ],
        "frames_exclusive": [
          true
        ]
      },
      "reference_counts": {
        "first_frame_image": 1,
        "last_frame_image": 1,
        "reference_images": 15,
        "reference_videos": 0,
        "reference_audios": 3,
        "video": 1,
        "max_total": 18
      },
      "reference_transport": {
        "first_frame_image": [
          "public_https_url"
        ],
        "reference_images": [
          "public_https_url"
        ],
        "reference_audios": [
          "public_https_url"
        ]
      },
      "audio_requires_reference_images": {
        "enabled": true
      }
    }
  },
  "sourceReview": {
    "reviewedAt": "2026-10-21",
    "scope": "reviewed_source_not_live_availability",
    "source": "PureTokenPlus_web/config/model-metadata-official.json"
  }
}
