{
  "$schema": "https://puretokensx.com/schemas/model-profile.schema.json",
  "schemaVersion": 1,
  "capability": "video",
  "catalogUpdatedAt": "2026-10-18",
  "catalogCapturedAt": "2026-10-18T12:22:09.975Z",
  "id": "seedance-2.0",
  "parameterSchema": {
    "properties": {
      "first_frame_image": {
        "type": "string"
      },
      "last_frame_image": {
        "type": "string"
      },
      "duration": {
        "type": "integer",
        "enum": [
          4,
          5,
          6,
          7,
          8,
          9,
          10,
          11,
          12,
          13,
          14,
          15
        ],
        "default": 5
      },
      "aspect_ratio": {
        "type": "string",
        "enum": [
          "21:9",
          "16:9",
          "4:3",
          "1:1",
          "3:4",
          "9:16",
          "auto"
        ],
        "default": "16:9"
      },
      "resolution": {
        "type": "string",
        "enum": [
          "480p",
          "720p",
          "1080p",
          "4k"
        ],
        "default": "720p"
      },
      "generate_audio": {
        "type": "boolean",
        "default": true
      }
    },
    "constraints": {
      "reference_image": {
        "mime_types": [
          "image/jpeg",
          "image/png",
          "image/webp"
        ],
        "max_bytes": [
          10485759
        ],
        "min_width": [
          300
        ],
        "max_width": [
          6000
        ],
        "min_height": [
          300
        ],
        "max_height": [
          6000
        ],
        "min_ratio": [
          0.4
        ],
        "max_ratio": [
          2.5
        ]
      },
      "reference_video": {
        "mime_types": [
          "video/mp4",
          "video/quicktime"
        ],
        "max_bytes": [
          52428800
        ],
        "min_width": [
          300
        ],
        "max_width": [
          6000
        ],
        "min_height": [
          300
        ],
        "max_height": [
          6000
        ],
        "min_ratio": [
          0.4
        ],
        "max_ratio": [
          2.5
        ],
        "min_pixels": [
          409600
        ],
        "max_pixels": [
          2086876
        ],
        "min_fps": [
          24
        ],
        "max_fps": [
          60
        ],
        "min_seconds": [
          2
        ],
        "max_seconds": [
          15
        ],
        "max_total_seconds": [
          15
        ]
      },
      "reference_audio": {
        "mime_types": [
          "audio/mpeg",
          "audio/mp3",
          "audio/wav",
          "audio/x-wav",
          "audio/mp4",
          "audio/x-m4a"
        ],
        "max_bytes": [
          15728640
        ],
        "min_seconds": [
          2
        ],
        "max_total_seconds": [
          15
        ],
        "max_seconds": [
          15
        ]
      },
      "reference_transport": {
        "first_frame_image": [
          "public_https_url"
        ],
        "last_frame_image": [
          "public_https_url"
        ]
      },
      "exclusive_reference_sets": {
        "frames": [
          "first_frame_image",
          "last_frame_image"
        ],
        "references": [
          "image",
          "reference_images",
          "reference_videos",
          "reference_audios"
        ]
      }
    },
    "operations": {
      "image_to_video": {
        "request": {
          "method": "POST",
          "path": "/v1/videos",
          "contentType": "multipart/form-data"
        },
        "requiredBodyFields": [
          "model",
          "prompt",
          "image"
        ],
        "inputs": {
          "image": {
            "field": "image",
            "required": true,
            "minItems": 1,
            "maxItems": 1,
            "transports": [
              "multipart_file"
            ]
          }
        }
      },
      "reference_image_video": {
        "request": {
          "method": "POST",
          "path": "/v1/videos",
          "contentType": "multipart/form-data"
        },
        "requiredBodyFields": [
          "model",
          "prompt",
          "reference_images"
        ],
        "inputs": {
          "reference_images": {
            "field": "reference_images",
            "required": true,
            "minItems": 1,
            "maxItems": 9,
            "transports": [
              "multipart_file"
            ]
          }
        }
      },
      "reference_video": {
        "request": {
          "method": "POST",
          "path": "/v1/videos",
          "contentType": "multipart/form-data"
        },
        "requiredBodyFields": [
          "model",
          "prompt",
          "reference_videos"
        ],
        "inputs": {
          "reference_videos": {
            "field": "reference_videos",
            "required": true,
            "minItems": 1,
            "maxItems": 3,
            "transports": [
              "multipart_file"
            ]
          }
        }
      },
      "reference_audio": {
        "request": {
          "method": "POST",
          "path": "/v1/videos",
          "contentType": "multipart/form-data"
        },
        "requiredBodyFields": [
          "model",
          "prompt",
          "reference_audios"
        ],
        "inputs": {
          "reference_audios": {
            "field": "reference_audios",
            "required": true,
            "minItems": 1,
            "maxItems": 3,
            "transports": [
              "multipart_file"
            ]
          }
        }
      },
      "video_generation": {
        "request": {
          "method": "POST",
          "path": "/v1/videos",
          "contentType": "application/json"
        },
        "requiredBodyFields": [
          "model",
          "prompt"
        ],
        "inputs": {
          "reference_images": {
            "field": "reference_images",
            "minItems": 0,
            "maxItems": 9,
            "transports": [
              "https_url"
            ]
          },
          "reference_videos": {
            "field": "reference_videos",
            "minItems": 0,
            "maxItems": 3,
            "transports": [
              "https_url"
            ]
          },
          "reference_audios": {
            "field": "reference_audios",
            "minItems": 0,
            "maxItems": 3,
            "transports": [
              "https_url"
            ]
          }
        }
      },
      "first_frame_video": {
        "request": {
          "method": "POST",
          "path": "/v1/videos",
          "contentType": "multipart/form-data"
        },
        "requiredBodyFields": [
          "model",
          "prompt",
          "first_frame_image"
        ],
        "inputs": {
          "first_frame_image": {
            "field": "first_frame_image",
            "required": true,
            "minItems": 1,
            "maxItems": 1,
            "transports": [
              "multipart_file"
            ]
          }
        }
      },
      "last_frame_video": {
        "request": {
          "method": "POST",
          "path": "/v1/videos",
          "contentType": "multipart/form-data"
        },
        "requiredBodyFields": [
          "model",
          "prompt",
          "last_frame_image"
        ],
        "inputs": {
          "last_frame_image": {
            "field": "last_frame_image",
            "required": true,
            "minItems": 1,
            "maxItems": 1,
            "transports": [
              "multipart_file"
            ]
          }
        }
      },
      "first_last_frame_video": {
        "request": {
          "method": "POST",
          "path": "/v1/videos",
          "contentType": "multipart/form-data"
        },
        "requiredBodyFields": [
          "model",
          "prompt",
          "first_frame_image",
          "last_frame_image"
        ],
        "inputs": {
          "first_frame_image": {
            "field": "first_frame_image",
            "required": true,
            "minItems": 1,
            "maxItems": 1,
            "transports": [
              "multipart_file"
            ]
          },
          "last_frame_image": {
            "field": "last_frame_image",
            "required": true,
            "minItems": 1,
            "maxItems": 1,
            "transports": [
              "multipart_file"
            ]
          }
        }
      }
    }
  }
}
