{
  "$schema": "https://puretokensx.com/schemas/model-profile.schema.json",
  "schemaVersion": 1,
  "capability": "video",
  "catalogUpdatedAt": "2026-10-24",
  "catalogCapturedAt": "2026-10-24T11:09:36.781Z",
  "id": "MiniMax-H3",
  "parameterSchema": {
    "properties": {
      "prompt": {
        "type": "string",
        "required": true
      },
      "duration": {
        "type": "integer",
        "enum": [
          1,
          2,
          3,
          4,
          5,
          6,
          7,
          8,
          9,
          10,
          11,
          12,
          13,
          14,
          15
        ],
        "default": 5
      },
      "resolution": {
        "type": "string",
        "enum": [
          "768p"
        ],
        "default": "768p"
      },
      "aspect_ratio": {
        "type": "string",
        "enum": [
          "21:9",
          "16:9",
          "4:3",
          "1:1",
          "3:4",
          "9:16",
          "adaptive"
        ],
        "default": "16:9"
      },
      "first_frame_image": {
        "type": "string"
      },
      "last_frame_image": {
        "type": "string"
      },
      "reference_images": {
        "type": "string[]"
      },
      "reference_videos": {
        "type": "string[]"
      },
      "reference_audios": {
        "type": "string[]"
      }
    },
    "operations": {
      "image_to_video": {
        "request": {
          "method": "POST",
          "path": "/v1/videos",
          "contentType": "application/json"
        },
        "requiredBodyFields": [
          "model",
          "prompt",
          "first_frame_image"
        ],
        "inputs": {
          "first_frame_image": {
            "field": "first_frame_image",
            "required": true,
            "minItems": 1,
            "maxItems": 1,
            "transports": [
              "https_url"
            ]
          }
        }
      },
      "last_frame_video": {
        "request": {
          "method": "POST",
          "path": "/v1/videos",
          "contentType": "application/json"
        },
        "requiredBodyFields": [
          "model",
          "prompt",
          "last_frame_image"
        ],
        "inputs": {
          "last_frame_image": {
            "field": "last_frame_image",
            "required": true,
            "minItems": 1,
            "maxItems": 1,
            "transports": [
              "https_url"
            ]
          }
        }
      },
      "reference_image_video": {
        "request": {
          "method": "POST",
          "path": "/v1/videos",
          "contentType": "application/json"
        },
        "requiredBodyFields": [
          "model",
          "prompt",
          "reference_images"
        ],
        "inputs": {
          "reference_images": {
            "field": "reference_images",
            "required": true,
            "minItems": 1,
            "maxItems": 9,
            "transports": [
              "https_url"
            ]
          }
        }
      },
      "reference_video": {
        "request": {
          "method": "POST",
          "path": "/v1/videos",
          "contentType": "application/json"
        },
        "requiredBodyFields": [
          "model",
          "prompt",
          "reference_videos"
        ],
        "inputs": {
          "reference_videos": {
            "field": "reference_videos",
            "required": true,
            "minItems": 1,
            "maxItems": 3,
            "transports": [
              "https_url"
            ]
          }
        }
      },
      "reference_audio": {
        "request": {
          "method": "POST",
          "path": "/v1/videos",
          "contentType": "application/json"
        },
        "requiredBodyFields": [
          "model",
          "prompt",
          "reference_audios"
        ],
        "inputs": {
          "reference_audios": {
            "field": "reference_audios",
            "required": true,
            "minItems": 1,
            "maxItems": 3,
            "transports": [
              "https_url"
            ]
          }
        }
      },
      "video_generation": {
        "request": {
          "method": "POST",
          "path": "/v1/videos",
          "contentType": "application/json"
        },
        "requiredBodyFields": [
          "model",
          "prompt"
        ],
        "inputs": {
          "reference_images": {
            "field": "reference_images",
            "required": false,
            "maxItems": 9,
            "transports": [
              "https_url"
            ]
          },
          "reference_videos": {
            "field": "reference_videos",
            "required": false,
            "maxItems": 3,
            "transports": [
              "https_url"
            ]
          },
          "reference_audios": {
            "field": "reference_audios",
            "required": false,
            "maxItems": 3,
            "transports": [
              "https_url"
            ]
          }
        }
      }
    },
    "lifecycle": {
      "create": {
        "successStatus": 200,
        "idField": "id",
        "object": "video",
        "initialStatuses": [
          "queued",
          "in_progress"
        ]
      },
      "poll": {
        "method": "GET",
        "path": "/v1/videos/{task_id}",
        "intervalSeconds": 8,
        "statusField": "status",
        "pendingStatuses": [
          "queued",
          "in_progress"
        ],
        "successStatuses": [
          "completed"
        ],
        "failureStatuses": [
          "failed"
        ],
        "resultFields": [
          "metadata.url"
        ]
      }
    },
    "constraints": {
      "reference_combination": {
        "audio_requires_visual": [
          false
        ],
        "frames_exclusive": [
          true
        ],
        "adaptive_requires_visual": [
          true
        ]
      },
      "reference_image": {
        "min_width": [
          256
        ],
        "max_width": [
          5760
        ],
        "min_height": [
          256
        ],
        "max_height": [
          5760
        ],
        "min_ratio": [
          0.4
        ],
        "max_ratio": [
          2.5
        ],
        "max_bytes": [
          30000000
        ],
        "max_pixels": [
          33177600
        ]
      },
      "reference_video": {
        "max_bytes": [
          50000000
        ],
        "min_seconds": [
          2
        ]
      },
      "reference_audio": {
        "max_bytes": [
          15000000
        ],
        "min_seconds": [
          2
        ]
      },
      "reference_counts": {
        "first_frame_image": 1,
        "last_frame_image": 1,
        "reference_images": 9,
        "reference_videos": 3,
        "reference_audios": 3,
        "video": 1,
        "max_total": 12
      },
      "reference_transport": {
        "first_frame_image": [
          "public_https_url"
        ],
        "last_frame_image": [
          "public_https_url"
        ],
        "reference_images": [
          "public_https_url"
        ],
        "reference_videos": [
          "public_https_url"
        ],
        "reference_audios": [
          "public_https_url"
        ]
      }
    }
  },
  "sourceReview": {
    "reviewedAt": "2026-10-21",
    "scope": "reviewed_source_not_live_availability",
    "source": "PureTokenPlus_web/config/model-metadata-official.json"
  }
}
