{
  "$schema": "https://puretokensx.com/schemas/model-profile.schema.json",
  "schemaVersion": 1,
  "capability": "video",
  "catalogUpdatedAt": "2026-10-18",
  "catalogCapturedAt": "2026-10-18T12:22:09.975Z",
  "id": "seedance2.0",
  "parameterSchema": {
    "properties": {
      "prompt": {
        "type": "string",
        "required": true
      },
      "duration": {
        "type": "integer",
        "required": true,
        "enum": [
          4,
          5,
          6,
          7,
          8,
          9,
          10,
          11,
          12,
          13,
          14,
          15
        ],
        "default": 8
      },
      "aspect_ratio": {
        "type": "string",
        "enum": [
          "21:9",
          "16:9",
          "4:3",
          "1:1",
          "3:4",
          "9:16"
        ],
        "default": "16:9"
      },
      "resolution": {
        "type": "string",
        "enum": [
          "720p"
        ],
        "default": "720p"
      }
    },
    "operations": {
      "text_to_video": {
        "request": {
          "method": "POST",
          "path": "/v1/videos",
          "contentType": "application/json"
        },
        "requiredBodyFields": [
          "model",
          "prompt",
          "duration"
        ]
      },
      "image_to_video": {
        "request": {
          "method": "POST",
          "path": "/v1/videos",
          "contentType": "application/json"
        },
        "requiredBodyFields": [
          "model",
          "prompt",
          "duration",
          "image"
        ],
        "inputs": {
          "image": {
            "field": "image",
            "required": true,
            "minItems": 1,
            "maxItems": 1,
            "transports": [
              "https_url"
            ]
          }
        }
      },
      "reference_image_video": {
        "request": {
          "method": "POST",
          "path": "/v1/videos",
          "contentType": "application/json"
        },
        "requiredBodyFields": [
          "model",
          "prompt",
          "duration",
          "reference_images"
        ],
        "inputs": {
          "reference_images": {
            "field": "reference_images",
            "required": true,
            "minItems": 1,
            "maxItems": 1,
            "transports": [
              "https_url"
            ]
          }
        }
      },
      "reference_video": {
        "request": {
          "method": "POST",
          "path": "/v1/videos",
          "contentType": "application/json"
        },
        "requiredBodyFields": [
          "model",
          "prompt",
          "duration",
          "reference_videos"
        ],
        "inputs": {
          "reference_videos": {
            "field": "reference_videos",
            "required": true,
            "minItems": 1,
            "maxItems": 1,
            "transports": [
              "https_url"
            ]
          }
        }
      },
      "reference_audio": {
        "request": {
          "method": "POST",
          "path": "/v1/videos",
          "contentType": "application/json"
        },
        "requiredBodyFields": [
          "model",
          "prompt",
          "duration",
          "reference_audios"
        ],
        "inputs": {
          "reference_audios": {
            "field": "reference_audios",
            "required": true,
            "minItems": 1,
            "maxItems": 1,
            "transports": [
              "https_url"
            ]
          }
        }
      }
    }
  }
}
